{
  "schema_version": "1.0",
  "status": "partial",
  "request_id": "synthetic-contract-example",
  "generated_at": "2026-10-09T00:00:00Z",
  "data": {"routes": [], "total": 0},
  "provider_status": [{"provider": "synthetic-unavailable-provider", "status": "degraded", "reason": "Contract fixture: no source coverage"}],
  "warnings": ["Synthetic envelope fixture only; not a live search or closure result."]
}
